{
  "$schema": "http://json-schema.org/draft-07/schema#",
  "$id": "https://raw.githubusercontent.com/TowoLabs/token-list/master/tokenlist.schema.json",
  "title": "Bifrost Wallet Token List",
  "description": "Schema for lists of tokens compatible with Bifrost Wallet",
  "definitions": {
    "Version": {
      "type": "object",
      "description": "The version of the list, used in change detection",
      "examples": [
        {
          "major": 1,
          "minor": 0,
          "patch": 0
        }
      ],
      "additionalProperties": false,
      "properties": {
        "major": {
          "type": "integer",
          "description": "The major version of the list. Must be incremented when tokens are removed from the list or token addresses are changed.",
          "minimum": 0,
          "examples": [
            1,
            2
          ]
        },
        "minor": {
          "type": "integer",
          "description": "The minor version of the list. Must be incremented when tokens are added to the list.",
          "minimum": 0,
          "examples": [
            0,
            1
          ]
        },
        "patch": {
          "type": "integer",
          "description": "The patch version of the list. Must be incremented for any changes to the list.",
          "minimum": 0,
          "examples": [
            0,
            1
          ]
        }
      },
      "required": [
        "major",
        "minor",
        "patch"
      ]
    },
    "TokenInfo": {
      "type": "object",
      "description": "Metadata for a single token in a token list",
      "additionalProperties": false,
      "properties": {
        "chainId": {
          "type": "integer",
          "description": "The chain ID of the EVM-compatible network where this token is deployed. Enum may only include supported live networks.",
          "enum": [1, 10, 19, 56, 137, 250, 42161],
          "examples": [
            1,
            19
          ]
        },
        "address": {
          "type": "string",
          "description": "The checksummed address of the token on the specified chain ID",
          "pattern": "^0x[a-fA-F0-9]{40}$",
          "examples": [
            "0xA0b86991c6218b36c1d19D4a2e9Eb0cE3606eB48"
          ]
        },
        "decimals": {
          "type": "integer",
          "description": "The number of decimals for the token balance",
          "minimum": 0,
          "maximum": 255,
          "examples": [
            18
          ]
        },
        "name": {
          "type": "string",
          "description": "The name of the token",
          "minLength": 1,
          "maxLength": 40,
          "pattern": "^[ \\w.'+\\-%/À-ÖØ-öø-ÿ:&\\[\\]\\(\\)]+$",
          "examples": [
            "USD Coin"
          ]
        },
        "symbol": {
          "type": "string",
          "description": "The symbol for the token; must be alphanumeric",
          "pattern": "^[a-zA-Z0-9+\\-%/$.]+$",
          "minLength": 1,
          "maxLength": 64,
          "examples": [
            "USDC"
          ]
        },
        "logoURI": {
          "type": "string",
          "description": "A URI to the token logo asset; must be PNG",
          "format": "uri",
          "pattern": "^https:\\/\\/raw\\.githubusercontent\\.com\\/TowoLabs\\/token-list\\/master\\/assets\\/0x[A-Fa-f0-9]{40}\\.png$",
          "examples": [
            "https://raw.githubusercontent.com/TowoLabs/token-list/master/assets/0x0d94e59332732d18cf3a3d457a8886a2ae29ea1b.png"
          ]
        }
      },
      "required": [
        "chainId",
        "address",
        "decimals",
        "name",
        "symbol",
        "logoURI"
      ]
    }
  },
  "type": "object",
  "additionalProperties": false,
  "properties": {
    "name": {
      "type": "string",
      "description": "The name of the token list",
      "minLength": 1,
      "maxLength": 20,
      "pattern": "^[A-Za-z ]+$",
      "examples": [
        "My Token List"
      ]
    },
    "timestamp": {
      "type": "string",
      "format": "date-time",
      "description": "The timestamp of this list version; i.e. when this immutable version of the list was created"
    },
    "version": {
      "$ref": "#/definitions/Version"
    },
    "tokens": {
      "type": "array",
      "description": "The list of tokens included in the list",
      "items": {
        "$ref": "#/definitions/TokenInfo"
      },
      "minItems": 1,
      "maxItems": 10000
    },
    "keywords": {
      "type": "array",
      "description": "Keywords associated with the contents of the list; may be used in list discoverability",
      "items": {
        "type": "string",
        "description": "A keyword to describe the contents of the list",
        "minLength": 1,
        "maxLength": 20,
        "pattern": "^[a-z ]+$",
        "examples": [
          "default",
          "list"
        ]
      },
      "maxItems": 10,
      "uniqueItems": true
    },
    "logoURI": {
      "type": "string",
      "description": "A URI for the logo of the token list",
      "format": "uri",
      "enum": ["https://raw.githubusercontent.com/TowoLabs/token-list/master/assets/bifrost-wallet.png"]
    }
  },
  "required": [
    "name",
    "timestamp",
    "version",
    "tokens",
    "logoURI"
  ]
}
